<?xml version="1.0" encoding="UTF-8"?>
<promocodes xmlns:xsi="http://www.w3.org/2001/XMLSchema-instance"
            xsi:noNamespaceSchemaLocation="promocodes.xsd">
    <promocode>
        <promoId>1</promoId>
        <code>WELCOME10</code>
        <discount>10.00</discount>
        <expiryDate>2025-08-31</expiryDate>
        <isActive>true</isActive>
    </promocode>
    <promocode>
        <promoId>2</promoId>
        <code>SUMMER20</code>
        <discount>20.00</discount>
        <expiryDate>2025-08-31</expiryDate>
        <isActive>true</isActive>
    </promocode>
</promocodes>